tree_id,slot,rune_id,key,name,shortDesc,longDesc,icon,sourceUrl
8100,0,8112,Electrocute,Electrocute,Hitting a champion with 3 separate attacks or abilities in 3s deals bonus adaptive damage .,"Hitting a champion with 3 separate attacks or abilities within 3s deals bonus adaptive damage . Damage: 70 - 240 (+0.1 bonus AD, +0.05 AP) damage. Cooldown: 20s 'We called them the Thunderlords, for to speak of their lightning was to invite disaster.'",images/runes/domination_electrocute.png,https://raw.communitydragon.org/latest/game/assets/perks/styles/domination/electrocute/electrocute.png
8100,0,8128,DarkHarvest,Dark Harvest,Damaging a low health champion inflicts adaptive damage and harvests a soul from the victim.,"Damaging a Champion below 50% health deals adaptive damage and harvests their soul, permanently increasing Dark Harvest's damage by 11. Dark Harvest damage: 30 (+11 damage per soul) (+0.1 bonus AD) (+0.05 AP) Cooldown: 35s (resets to 1.0s on takedown)",images/runes/domination_dark_harvest.png,https://raw.communitydragon.org/latest/game/assets/perks/styles/domination/darkharvest/darkharvest.png
8100,0,9923,HailOfBlades,Hail of Blades,Gain a large amount of Attack Speed for the first 3 attacks made against enemy champions.,Gain 160% (80% for ranged champions) Attack Speed when you attack an enemy champion for up to 3 attacks. No more than 3s can elapse between attacks or this effect will end. Cooldown: 10s. Attack resets increase the attack limit by 1. Allows you to temporarily exceed the Attack Speed limit.,images/runes/domination_hail_of_blades.png,https://raw.communitydragon.org/latest/game/assets/perks/styles/domination/hailofblades/hailofblades.png
8100,1,8126,CheapShot,Cheap Shot,Deal bonus true damage to enemy champions with impaired movement or actions .,Damaging champions with impaired movement or actions deals 10 - 45 bonus true damage (based on level). Cooldown: 4s Activates on damage occurring after the impairment.,images/runes/domination_cheap_shot.png,https://raw.communitydragon.org/latest/game/assets/perks/styles/domination/cheapshot/cheapshot.png
8100,1,8139,TasteOfBlood,Taste of Blood,Heal when you damage an enemy champion.,"Heal when you damage an enemy champion. Healing: 16-40 (+0.1 bonus AD, +0.05 AP) health (based on level) Cooldown: 20s",images/runes/domination_taste_of_blood.png,https://raw.communitydragon.org/latest/game/assets/perks/styles/domination/tasteofblood/greenterror_tasteofblood.png
8100,1,8143,SuddenImpact,Sudden Impact,"Damaging basic attacks and abilities deal bonus true damage to enemy champions after using a dash, leap, blink, teleport, or when leaving stealth.","Damaging basic attacks and abilities deal a bonus 20 - 80 True Damage based on level to enemy champions after using a dash, leap, blink, teleport, or when leaving stealth for 4s. Cooldown: 10s",images/runes/domination_sudden_impact.png,https://raw.communitydragon.org/latest/game/assets/perks/styles/domination/suddenimpact/suddenimpact.png
8100,2,8137,SixthSense,Sixth Sense,"On a long Cooldown, automatically sense a nearby untracked and unseen ward, tracking it for the team. Level 11: Also reveal the ward for 10s.","Automatically sense a nearby untracked and unseen ward, tracking it for the team. Level 11: Also reveal the ward for 10s. This effect has a 250 second Cooldown.",images/runes/domination_sixth_sense.png,https://raw.communitydragon.org/latest/game/assets/perks/styles/domination/sixthsense/sixthsense.png
8100,2,8140,GrislyMementos,Grisly Mementos,"Collect 1 memento on champion takedowns , up to 18 total. Gain 6 Trinket Haste for each collected.","Collect 1 memento on champion takedowns , up to 18 total. Gain 6 Trinket Haste for each collected. In game modes where vision Trinkets do not exist, instead gain 3 Summoner Spell Haste.",images/runes/domination_grisly_mementos.png,https://raw.communitydragon.org/latest/game/assets/perks/styles/domination/grislymementos/grislymementos.png
8100,2,8141,DeepWard,Deep Ward,"Your wards in the enemy jungle are Deep , gaining Health and Duration. Level 9: Wards in the river are also Deep .",Your wards in the enemy jungle are Deep . Deep wards gain +1 extra Health and +[30 - 45]s increased duration (+[45 - 150]s for Trinket stealth wards). Level 9: Wards in the river are also Deep .,images/runes/domination_deep_ward.png,https://raw.communitydragon.org/latest/game/assets/perks/styles/domination/deepward/deepward.png
8100,3,8135,TreasureHunter,Treasure Hunter,Unique takedowns grant additional gold the first time they are collected.,"Gain an additional 50 gold the next time you collect a Bounty Hunter stack. Increase the gold gained by 20 gold for each Bounty Hunter stack, up to 130 gold . Bounty Hunter stacks are earned the first time you get a takedown on each enemy champion.",images/runes/domination_treasure_hunter.png,https://raw.communitydragon.org/latest/game/assets/perks/styles/domination/treasurehunter/treasurehunter.png
8100,3,8105,RelentlessHunter,Relentless Hunter,Unique takedowns grant permanent out of combat MS .,Gain 8 Move Speed out of combat per Bounty Hunter stack. Bounty Hunter stacks are earned the first time you get a takedown on each enemy champion.,images/runes/domination_relentless_hunter.png,https://raw.communitydragon.org/latest/game/assets/perks/styles/domination/relentlesshunter/relentlesshunter.png
8100,3,8106,UltimateHunter,Ultimate Hunter,Unique takedowns grant permanent cooldown reduction on your Ultimate.,"Your ultimate gains 6 Ability Haste, plus an additional 5 Ability Haste per Bounty Hunter stack. Bounty Hunter stacks are earned the first time you get a takedown on each enemy champion.",images/runes/domination_ultimate_hunter.png,https://raw.communitydragon.org/latest/game/assets/perks/styles/domination/ultimatehunter/ultimatehunter.png
8300,0,8351,GlacialAugment,Glacial Augment,Immobilizing an enemy champion will cause 3 glacial rays that slow nearby enemies and reduce their damage to your allies.,"Immobilizing an enemy champion will cause 3 glacial rays to emanate from them towards you and other nearby champions, creating frozen zones for 3 (+ the immobilizing effect's duration) seconds that slow enemies for 20% (+90% per 100% Heal and Shield Power) (+6% per 100 Ability Power) (+7% per 100 bonus Attack Damage) and reduce their damage by 15% against your allies (not including yourself). Cooldown: 25s",images/runes/inspiration_glacial_augment.png,https://raw.communitydragon.org/latest/game/assets/perks/styles/inspiration/glacialaugment/glacialaugment.png
8300,0,8360,UnsealedSpellbook,Unsealed Spellbook,Swap Summoner Spells while out of combat. Swapping to unique Summoner Spells will increase the rate at which you can make future swaps.,"Swap one of your equipped Summoner Spells to a new, single use Summoner Spell. Each unique Summoner Spell you swap to permanently decreases your swap cooldown by 25s (initial swap cooldown is @f3@ seconds). Your first swap becomes available at 6 mins. Summoner Spells can only be swapped while out of combat. After using a swapped Summoner Spell you must swap 3 more times before the first can be selected again. Smite damage increases after two Summoner Spell swaps.",images/runes/inspiration_unsealed_spellbook.png,https://raw.communitydragon.org/latest/game/assets/perks/styles/inspiration/unsealedspellbook/unsealedspellbook.png
8300,0,8369,FirstStrike,First Strike,"When you initiate champion combat, deal 7% extra damage for 3 seconds and gain gold based on damage dealt.","Attacks or abilities against an enemy champion within 0.25s of entering champion combat grant 10 gold and First Strike for 3 seconds, causing you to deal 7% extra damage against champions, and granting 50% (35% for ranged champions) of bonus damage dealt as gold . Cooldown: 25 - 15 s",images/runes/inspiration_first_strike.png,https://raw.communitydragon.org/latest/game/assets/perks/styles/inspiration/firststrike/firststrike.png
8300,1,8306,HextechFlashtraption,Hextech Flashtraption,"While Flash is on cooldown it is replaced by Hexflash . Hexflash : Channel, then blink to a new location.",While Flash is on cooldown it is replaced by Hexflash . Hexflash : Channel for 2s to blink to a new location. Cooldown: 20s. Goes on a 10s cooldown when you enter champion combat.,images/runes/inspiration_hextech_flashtraption.png,https://raw.communitydragon.org/latest/game/assets/perks/styles/inspiration/hextechflashtraption/hextechflashtraption.png
8300,1,8304,MagicalFootwear,Magical Footwear,You get free boots at 12 min but you cannot buy boots before then. Each takedown you get makes your boots come 45s sooner.,"You get free Slightly Magical Footwear at 12 min, but you cannot buy boots before then. For each takedown you acquire the boots 45s sooner. Slightly Magical Footwear grants you an additional 10 Move Speed .",images/runes/inspiration_magical_footwear.png,https://raw.communitydragon.org/latest/game/assets/perks/styles/inspiration/magicalfootwear/magicalfootwear.png
8300,1,8321,CashBack,Cash Back,Get some gold back when you purchase Legendary Items.,Get 8% Gold back when you purchase Legendary Items.,images/runes/inspiration_cash_back.png,https://raw.communitydragon.org/latest/game/assets/perks/styles/inspiration/cashback/cashback2.png
8300,2,8313,PerfectTiming,Triple Tonic,"Upon reaching level 3, gain an Elixir of Avarice. Upon reaching level 6, gain an Elixir of Force. Upon reaching level 9, gain an Elixir of Skill.","Upon reaching level 3, gain an Elixir of Avarice. Upon reaching level 6, gain an Elixir of Force. Upon reaching level 9, gain an Elixir of Skill.",images/runes/inspiration_triple_tonic.png,https://raw.communitydragon.org/latest/game/assets/perks/styles/inspiration/perfecttiming/alchemistcabinet.png
8300,2,8352,TimeWarpTonic,Time Warp Tonic,Potions grant some restoration immediately.,Consuming a potion grants 40% of its health restoration immediately.,images/runes/inspiration_time_warp_tonic.png,https://raw.communitydragon.org/latest/game/assets/perks/styles/inspiration/timewarptonic/timewarptonic.png
8300,2,8345,BiscuitDelivery,Biscuit Delivery,"Gain a free Biscuit every 2 min, until 6 min. Consuming or selling a Biscuit permanently increases your max health and restores health.","Biscuit Delivery: Gain a Total Biscuit of Everlasting Will every 2 mins, until 6 min. Biscuits restore 20 + 2% of your maximum health, increased by up to 100% based on missing Health. Consuming or selling a Biscuit permanently increases your max health by 30.",images/runes/inspiration_biscuit_delivery.png,https://raw.communitydragon.org/latest/game/assets/perks/styles/inspiration/biscuitdelivery/biscuitdelivery.png
8300,3,8347,CosmicInsight,Cosmic Insight,+ 18 Summoner Spell Haste + 10 Item Haste,+ 18 Summoner Spell Haste + 10 Item Haste,images/runes/inspiration_cosmic_insight.png,https://raw.communitydragon.org/latest/game/assets/perks/styles/inspiration/cosmicinsight/cosmicinsight.png
8300,3,8410,ApproachVelocity,Approach Velocity,"Bonus MS towards nearby enemy champions that are movement impaired , increased for enemy champions that you impair.",Gain 7.5% Move Speed towards nearby enemy champions that are movement impaired. This bonus is increased to 15% Move Speed for any enemy champion that you impair. Activation Range for CC from allies: 1000,images/runes/inspiration_approach_velocity.png,https://raw.communitydragon.org/latest/game/assets/perks/styles/resolve/approachvelocity/approachvelocity.png
8300,3,8316,JackOfAllTrades,Jack Of All Trades,"For each different stat gained from items, gain one Jack stack. Each stack grants you 1 Ability Haste . Gain bonus Adaptive Force at 5 and 10 stacks.","For each different stat gained from items, gain one Jack stack. Each stack grants you 1 Ability Haste . Gain 10 or 25 bonus Adaptive Force at 5 and 10 stacks, respectively.",images/runes/inspiration_jack_of_all_trades.png,https://raw.communitydragon.org/latest/game/assets/perks/styles/inspiration/jackofalltrades/jackofalltrades2.png
8000,0,8005,PressTheAttack,Press the Attack,Hitting an enemy champion 3 consecutive times deals bonus damage and amplifies your damage until you leave combat with champions.,Hitting an enemy champion with 3 consecutive basic attacks deals 40 - 160 bonus adaptive damage (based on level) and amplifies your damage dealt by 8% until you leave combat with champions.,images/runes/precision_press_the_attack.png,https://raw.communitydragon.org/latest/game/assets/perks/styles/precision/presstheattack/presstheattack.png
8000,0,8008,LethalTempo,Lethal Tempo,"Attacking an enemy champion grants you Attack Speed, up to 6 stacks. At max stacks, deal bonus adaptive damage On-Attack.","Attacking an enemy champion grants you [6% Melee || 4% Ranged] Attack Speed for 6 seconds, up to 6. At max stacks, deal [9 - 30 Melee || 6 - 24 Ranged] bonus adaptive damage On-Attack, increased by 1% per 1% Bonus Attack Speed .",images/runes/precision_lethal_tempo.png,https://raw.communitydragon.org/latest/game/assets/perks/styles/precision/lethaltempo/lethaltempotemp.png
8000,0,8021,FleetFootwork,Fleet Footwork,"Attacking and moving builds Energy stacks. At 100 stacks, your next attack heals you and grants increased MS .","Attacking and moving builds Energy stacks. At 100 stacks, your next attack is Energized Energized attacks heal you for 10 - 130 (+0.1 Bonus AD, +0.05 AP) and grant 20% Move Speed for 1s. For Ranged Champions, Healing is 60% effective and Move Speed is 75% effective. All healing is 15% effective against Minions.",images/runes/precision_fleet_footwork.png,https://raw.communitydragon.org/latest/game/assets/perks/styles/precision/fleetfootwork/fleetfootwork.png
8000,0,8010,Conqueror,Conqueror,"Gain stacks of adaptive force when attacking enemy champions. After reaching 12 stacks, heal for a portion of damage you deal to champions.","Basic attacks or spells that deal damage to an enemy champion grant 2 stacks of Conqueror for 5s, gaining 1.8-4 Adaptive Force per stack. Stacks up to 12 times. Ranged champions gain only 1 stack per basic attack. When fully stacked, heal for 8% of the damage you deal to champions (5% for ranged champions).",images/runes/precision_conqueror.png,https://raw.communitydragon.org/latest/game/assets/perks/styles/precision/conqueror/conqueror.png
8000,1,9101,AbsorbLife,Absorb Life,Killing a target heals you.,Killing a target heals you for @HealAmount@.,images/runes/precision_absorb_life.png,https://raw.communitydragon.org/latest/game/assets/perks/styles/precision/absorblife/absorblife.png
8000,1,9111,Triumph,Triumph,Takedowns restore 5% of your missing health and grant an additional 20 gold.,"Takedowns restore 5% of your missing health, 2.5% of your max health, and grant an additional 20 gold. 'The most dangerous game brings the greatest glory.' —Noxian Reckoner",images/runes/precision_triumph.png,https://raw.communitydragon.org/latest/game/assets/perks/styles/precision/triumph.png
8000,1,8009,PresenceOfMind,Presence of Mind,Restore a small amount of mana or energy when damaging an enemy champion. Takedowns restore mana or energy.,Damaging an enemy champion restores 6-50 (80% for ranged) mana or 6 energy. Takedowns restore 15% of your maximum mana or energy. Cooldown for damage restoration: 8s,images/runes/precision_presence_of_mind.png,https://raw.communitydragon.org/latest/game/assets/perks/styles/precision/presenceofmind/presenceofmind.png
8000,2,9104,LegendAlacrity,Legend: Alacrity,Takedowns on enemies grant permanent Attack Speed .,"Gain 3% attack speed plus an additional 1.5% for every Legend stack ( max 10 stacks ). Earn progress toward Legend stacks for every champion takedown, epic monster takedown, large monster kill, and minion kill.",images/runes/precision_legend_alacrity.png,https://raw.communitydragon.org/latest/game/assets/perks/styles/precision/legendalacrity/legendalacrity.png
8000,2,9105,LegendHaste,Legend: Haste,Takedowns on enemies grant permanent Basic Ability Haste .,"Gain 1.5 basic ability haste for every Legend stack ( max 10 stacks ). Earn progress toward Legend stacks for every champion takedown, epic monster takedown, large monster kill, and minion kill.",images/runes/precision_legend_haste.png,https://raw.communitydragon.org/latest/game/assets/perks/styles/precision/legendhaste/legendhaste.png
8000,2,9103,LegendBloodline,Legend: Bloodline,"Takedowns on enemies grant permanent Life Steal , up to a cap. Once the cap is reached, increase your max health. Weaker earlier but stronger later game than other Legend Runes.","Gain 0.45% Life Steal for every Legend stack ( max 15 stacks ). At maximum Legend stacks, gain 85 max health . Earn progress toward Legend stacks for every champion takedown, epic monster takedown, large monster kill, and minion kill.",images/runes/precision_legend_bloodline.png,https://raw.communitydragon.org/latest/game/assets/perks/styles/precision/legendbloodline/legendbloodline.png
8000,3,8014,CoupDeGrace,Coup de Grace,Deal more damage to low health enemy champions.,Deal 8% more damage to champions who have less than 40% health.,images/runes/precision_coup_de_grace.png,https://raw.communitydragon.org/latest/game/assets/perks/styles/precision/coupdegrace/coupdegrace.png
8000,3,8017,CutDown,Cut Down,Deal more damage to high health enemy champions.,Deal 8% more damage to champions who have more than 60% health.,images/runes/precision_cut_down.png,https://raw.communitydragon.org/latest/game/assets/perks/styles/precision/cutdown/cutdown.png
8000,3,8299,LastStand,Last Stand,Deal more damage to champions while you are low on health.,Deal 5% - 11% increased damage to champions while you are below 60% health. Max damage gained at 30% health.,images/runes/precision_last_stand.png,https://raw.communitydragon.org/latest/game/assets/perks/styles/sorcery/laststand/laststand.png
8400,0,8437,GraspOfTheUndying,Grasp of the Undying,"Every 4s your next attack on a champion deals bonus magic damage, heals you, and permanently increases your health.","Every 4s in combat, your next basic attack on a champion will: Deal bonus magic damage equal to 3.5% of your max health Heal you for 1.3% of your max health Permanently increase your health by 5 Ranged Champions: Damage, healing, and permanent health gained are 40% effective.",images/runes/resolve_grasp_of_the_undying.png,https://raw.communitydragon.org/latest/game/assets/perks/styles/resolve/graspoftheundying/graspoftheundying.png
8400,0,8439,Aftershock,Aftershock,After immobilizing an enemy champion gain defenses and later deal a burst of magic damage around you.,"After immobilizing an enemy champion, increase your Armor and Magic Resist by 35 + 80% of your Bonus Resists for 2.5s. Then explode, dealing magic damage to nearby enemies. Damage: 25 - 120 (+8% of your bonus health) Cooldown: 20s Resistance bonus from Aftershock capped at: 80-150 (based on level)",images/runes/resolve_aftershock.png,https://raw.communitydragon.org/latest/game/assets/perks/styles/resolve/veteranaftershock/veteranaftershock.png
8400,0,8465,Guardian,Guardian,"Guard allies you cast spells on and those that are very nearby. If you or a guarded ally would take damage based on level, you're both granted a shield.","Guard allies within 350 units of you, and allies you target with spells for 2.5s. While Guarding , if you or the ally take more than a small amount of damage over the duration of the Guard , both of you gain a shield for 1.5s. Cooldown: 90 - 40 seconds Shield: 45 - 180 + 25% of your ability power + 5% of your bonus health Proc Threshold: 50 - 165 postmitigation damage",images/runes/resolve_guardian.png,https://raw.communitydragon.org/latest/game/assets/perks/styles/resolve/guardian/guardian.png
8400,1,8446,Demolish,Demolish,Charge up a powerful attack against a tower while near it.,"Charge up a powerful attack against a tower over 3s, while within 600 range of it. The charged attack deals 100 (+35% of your max health) bonus physical damage. Cooldown: 45s",images/runes/resolve_demolish.png,https://raw.communitydragon.org/latest/game/assets/perks/styles/resolve/demolish/demolish.png
8400,1,8463,FontOfLife,Font of Life,Impairing the movement of an enemy champion heals nearby allied champions.,Impairing the movement of an enemy champion restores @BaseHeal@ Health to you and the lowest health nearby allied champion. 70% effect for Ranged Users. Cooldown: 20s,images/runes/resolve_font_of_life.png,https://raw.communitydragon.org/latest/game/assets/perks/styles/resolve/fontoflife/fontoflife.png
8400,1,8401,ShieldBash,Shield Bash,"Whenever you gain a shield, your next basic attack against a champion deals bonus adaptive damage.","Whenever you gain a new shield,  your next basic attack against a champion deals 5 - 30 (+2.5% Bonus Health) (+15.0% New Shield Amount) bonus adaptive damage. You have up to 2s after the shield expires to use this effect.",images/runes/resolve_shield_bash.png,https://raw.communitydragon.org/latest/game/assets/perks/styles/resolve/mirrorshell/mirrorshell.png
8400,2,8429,Conditioning,Conditioning,After 12 min gain +8 Armor and +8 Magic Resist and increase your Armor and Magic Resist by 3%.,After 12 min gain +8 Armor and +8 Magic Resist and increase your Armor and Magic Resist by 3%.,images/runes/resolve_conditioning.png,https://raw.communitydragon.org/latest/game/assets/perks/styles/resolve/conditioning/conditioning.png
8400,2,8444,SecondWind,Second Wind,After taking damage from an enemy champion heal back some missing health over time.,"After taking damage from an enemy champion, heal for 4% of your missing health over 10s.",images/runes/resolve_second_wind.png,https://raw.communitydragon.org/latest/game/assets/perks/styles/resolve/secondwind/secondwind.png
8400,2,8473,BonePlating,Bone Plating,"After taking damage from an enemy champion, the next 3 spells or attacks you receive from them deal 30-60 (based on level) less damage. Duration: 1.5s Cooldown: 55s","After taking damage from an enemy champion, the next 3 spells or attacks you receive from them deal 30-60 (based on level) less damage. Duration: 1.5s Cooldown: 55s",images/runes/resolve_bone_plating.png,https://raw.communitydragon.org/latest/game/assets/perks/styles/resolve/boneplating/boneplating.png
8400,3,8451,Overgrowth,Overgrowth,Gain permanent max health when minions or monsters die near you.,"Absorb life essence from monsters or enemy minions that die near you, permanently gaining 3 maximum health for every 8. When you've absorbed 120 monsters or enemy minions, gain an additional 3.5% maximum health.",images/runes/resolve_overgrowth.png,https://raw.communitydragon.org/latest/game/assets/perks/styles/resolve/overgrowth/overgrowth.png
8400,3,8453,Revitalize,Revitalize,Gain 5% Heal and Shield Power. Heals and shields you cast or receive are 10% stronger on targets below 40% health.,Gain 5% Heal and Shield Power. Heals and shields you cast or receive are 10% stronger on targets below 40% health.,images/runes/resolve_revitalize.png,https://raw.communitydragon.org/latest/game/assets/perks/styles/resolve/revitalize/revitalize.png
8400,3,8242,Unflinching,Unflinching,Gain Armor and Magic Resist when receiving crowd control.,Gain 10 Armor and Magic Resist when crowd controlled and for 2 seconds after.,images/runes/resolve_unflinching.png,https://raw.communitydragon.org/latest/game/assets/perks/styles/sorcery/unflinching/unflinching.png
8200,0,8214,SummonAery,Summon Aery,"Your attacks and abilities send Aery to a target, damaging enemies or shielding allies.","Damaging enemy champions with basic attacks or abilities sends Aery to them, dealing 10 - 50 based on level (+ 0.05 AP ) (+ 0.1 bonus AD ). Empowering or protecting allies with abilities sends Aery to them, shielding them for 30 - 100 based on level (+ 0.05 AP ) (+ 0.1 bonus AD ). Aery cannot be sent out again until she returns to you.",images/runes/sorcery_summon_aery.png,https://raw.communitydragon.org/latest/game/assets/perks/styles/sorcery/summonaery/summonaery.png
8200,0,8229,ArcaneComet,Arcane Comet,Damaging a champion with an ability hurls a damaging comet at their location.,"Damaging a champion with an ability hurls a comet at their location, or, if Arcane Comet is on cooldown, reduces its remaining cooldown. Adaptive Damage : 30 - 130 based on level ( +0.05 AP and +0.1 bonus AD ) Cooldown: 20 - 8s Cooldown Reduction: Single Target: 20%. Area of Effect: 10%. Damage over Time: 5%.",images/runes/sorcery_arcane_comet.png,https://raw.communitydragon.org/latest/game/assets/perks/styles/sorcery/arcanecomet/arcanecomet.png
8200,0,8230,PhaseRush,Phase Rush,Hitting an enemy champion with 3 separate attacks or abilities grants a burst of MS and Slow Resist.,Hitting an enemy champion with 3 attacks or separate abilities within 4s grants 25 - 50% Move Speed based on level and 50% Slow Resistance for 3s. Move Speed is 75% effective for ranged champions. Cooldown: 30s - 10s,images/runes/sorcery_phase_rush.png,https://raw.communitydragon.org/latest/game/assets/perks/styles/sorcery/phaserush/phaserush.png
8200,1,8224,NullifyingOrb,Axiom Arcanist,"Your Ultimate has increased damage, healing, and shielding. Scoring a takedown on an enemy champion reduces your Ultimate's current cooldown.","Your Ultimate has 12% increased damage, healing, and shielding. (AoE damage is reduced to a 8% increase) Scoring a takedown on an enemy champion reduces your Ultimate's current cooldown by 7%.",images/runes/sorcery_axiom_arcanist.png,https://raw.communitydragon.org/latest/game/assets/perks/styles/sorcery/nullifyingorb/axiom_arcanist.png
