tree_id,slot,rune_id,key,name,shortDesc,longDesc,icon,sourceUrl
8200,1,8226,ManaflowBand,Manaflow Band,"Hitting an enemy champion with an ability permanently increases your maximum mana by 25, up to 250 mana. After reaching 250 bonus mana, restore 1% of your missing mana every 5 seconds.","Hitting an enemy champion with an ability permanently increases your maximum mana by 25, up to 250 mana. After reaching 250 bonus mana, restore 1% of your missing mana every 5 seconds. Cooldown: 15 seconds",images/runes/sorcery_manaflow_band.png,https://raw.communitydragon.org/latest/game/assets/perks/styles/sorcery/manaflowband/manaflowband.png
8200,1,8275,NimbusCloak,Nimbus Cloak,"After casting a Summoner Spell, gain a short Move Speed increase that allows you to pass through units.","After casting a Summoner Spell, gain a Move Speed increase that lasts for 2s and allows you to pass through units. Increase: 15% - 45% Move Speed based on the Summoner Spell's cooldown. (Higher cooldown Summoner Spells grant more Move Speed ).",images/runes/sorcery_nimbus_cloak.png,https://raw.communitydragon.org/latest/game/assets/perks/styles/sorcery/nimbuscloak/6361.png
8200,2,8210,Transcendence,Transcendence,"Gain bonuses upon reaching the following levels: Level 5: +5 Ability Haste Level 8: +5 Ability Haste Level 11: On Champion takedown, reduce the remaining cooldown of basic abilities by 20%.","Gain bonuses upon reaching the following levels: Level 5: +5 Ability Haste Level 8: +5 Ability Haste Level 11: On Champion takedown, reduce the remaining cooldown of basic abilities by 20%.",images/runes/sorcery_transcendence.png,https://raw.communitydragon.org/latest/game/assets/perks/styles/sorcery/transcendence/transcendence.png
8200,2,8234,Celerity,Celerity,All Move Speed bonuses are 7% more effective on you and gain 1% Move Speed .,All movement bonuses are 7% more effective on you and gain 1% Move Speed .,images/runes/sorcery_celerity.png,https://raw.communitydragon.org/latest/game/assets/perks/styles/sorcery/celerity/celeritytemp.png
8200,2,8233,AbsoluteFocus,Absolute Focus,"While above 70% health, gain extra adaptive damage .","While above 70% health, gain an adaptive bonus of up to 18 Attack Damage or 30 Ability Power (based on level). Grants 1.8 Attack Damage or 3 Ability Power at level 1.",images/runes/sorcery_absolute_focus.png,https://raw.communitydragon.org/latest/game/assets/perks/styles/sorcery/absolutefocus/absolutefocus.png
8200,3,8237,Scorch,Scorch,Your first damaging ability hit every 10s burns champions.,Your next damaging ability hit sets champions on fire dealing 20 - 40 bonus magic damage based on level after 1s. Cooldown: 10s,images/runes/sorcery_scorch.png,https://raw.communitydragon.org/latest/game/assets/perks/styles/sorcery/scorch/scorch.png
8200,3,8232,Waterwalking,Waterwalking,"Gain MS and AP or AD, adaptive in the river.",Gain 10 Move Speed and 13 - 30 Adaptive Force (based on level) when in the river. May you be as swift as the rushing river and agile as a startled Rift Scuttler.,images/runes/sorcery_waterwalking.png,https://raw.communitydragon.org/latest/game/assets/perks/styles/sorcery/waterwalking/waterwalking.png
8200,3,8236,GatheringStorm,Gathering Storm,"Gain increasing amounts of AD or AP, adaptive over the course of the game.","Every 10 min gain AP or AD, adaptive . 10 min : + 8 AP or 5 AD 20 min : + 24 AP or 14 AD 30 min : + 48 AP or 29 AD 40 min : + 80 AP or 48 AD 50 min : + 120 AP or 72 AD 60 min : + 168 AP or 101 AD etc...",images/runes/sorcery_gathering_storm.png,https://raw.communitydragon.org/latest/game/assets/perks/styles/sorcery/gatheringstorm/gatheringstorm.png
